source,title,description,text,label
CoinTelegraph,"Avalanche launches initiative for digital artists, NFT creator protests Sotheby’s gender bias, and more","The Avalanche Foundation has launched a new mentoring initiative for digital artists, and Ticketmaster has introduced a new feature allowing artists to reward NFT holders.","Source: CoinTelegraph Title: Avalanche launches initiative for digital artists, NFT creator protests Sotheby’s gender bias, and more Description: The Avalanche Foundation has launched a new mentoring initiative for digital artists, and Ticketmaster has introduced a new feature allowing artists to reward NFT holders.",1
CryptoNews,Bitcoin Price and Ethereum Prediction: Will BTC and ETH Shake Off the Shackles and Break Free of Tight Ranges?,"As the weekend approaches, cryptocurrency enthusiasts are keeping a close eye on Bitcoin (BTC) and Ethereum (ETH), wondering if these leading digital assets will manage to break free from their recent tight trading ranges.","Source: CryptoNews Title: Bitcoin Price and Ethereum Prediction: Will BTC and ETH Shake Off the Shackles and Break Free of Tight Ranges? Description: As the weekend approaches, cryptocurrency enthusiasts are keeping a close eye on Bitcoin (BTC) and Ethereum (ETH), wondering if these leading digital assets will manage to break free from their recent tight trading ranges.",0
CoinTelegraph,FTX EU launches withdrawal website to pay back European users,"FTX EU was only approved by the Cyprus regulator in March, 2022, about seven months before FTX collapsed in November.","Source: CoinTelegraph Title: FTX EU launches withdrawal website to pay back European users Description: FTX EU was only approved by the Cyprus regulator in March, 2022, about seven months before FTX collapsed in November.",1
CryptoPotato,Ledger Taps $1.4 Billion Valuation After Securing $109 Million Funding,"The hardware wallet manufacturer, Ledger, has secured a $109 Million funding round and is expected to conduct two more this year.","Source: CryptoPotato Title: Ledger Taps $1.4 Billion Valuation After Securing $109 Million Funding Description: The hardware wallet manufacturer, Ledger, has secured a $109 Million funding round and is expected to conduct two more this year.",1
CoinTelegraph,DAO treasuries top $25 billion for the first time: DeepDAO,"Assets held in DAO treasuries have more than doubled since the beginning of 2023, according to DeepDAO.","Source: CoinTelegraph Title: DAO treasuries top $25 billion for the first time: DeepDAO Description: Assets held in DAO treasuries have more than doubled since the beginning of 2023, according to DeepDAO.",1
CoinTelegraph,‘Killer use case’: Citi says trillions in assets could be tokenized by 2030,The bank predicts the private equity market to become the most “tokenized” asset class because it is more liquid and can be fractionalized.,Source: CoinTelegraph Title: ‘Killer use case’: Citi says trillions in assets could be tokenized by 2030 Description: The bank predicts the private equity market to become the most “tokenized” asset class because it is more liquid and can be fractionalized.,1
CryptoPotato,New Binance Smart Chain Proposal Seeks to Lower Transaction Fees: Report,The proposal is expected to make BSC more attactive then layer 2s. ,Source: CryptoPotato Title: New Binance Smart Chain Proposal Seeks to Lower Transaction Fees: Report Description: The proposal is expected to make BSC more attactive then layer 2s. ,1
CryptoNews,"Bitcoin Price Prediction as BTC Rally Intensifies with $20 Billion Trading Volume \x93Â\xa0Can BTC Reach $30,000 This Week?","Bitcoin, the world's largest cryptocurrency, has been experiencing an uptick in its price, surging by over 4% in the last few hours. However, the gains in Bitcoin's price seem to be fading, and it has lost some of its recent increases. \n\nThis could be because some experts, like Gareth Soloway from InTheMoneyStocks.com, predict...","Source: CryptoNews Title: Bitcoin Price Prediction as BTC Rally Intensifies with $20 Billion Trading Volume \x93Â\xa0Can BTC Reach $30,000 This Week? Description: Bitcoin, the world's largest cryptocurrency, has been experiencing an uptick in its price, surging by over 4% in the last few hours. However, the gains in Bitcoin's price seem to be fading, and it has lost some of its recent increases. \n\nThis could be because some experts, like Gareth Soloway from InTheMoneyStocks.com, predict...",1
CryptoPotato,Paxful to Refund Celsius Earn Deposits to Affected Company Members,The funds will be returned from Paxful’s reserves.\r\n,Source: CryptoPotato Title: Paxful to Refund Celsius Earn Deposits to Affected Company Members Description: The funds will be returned from Paxful’s reserves.\r\n,0
CryptoPotato,"Banking Sector Wary of Crypto After Silvergate, Signature Closures",A wave of crypto firms are searching for a home after major US banking partners fell apart this month – but finding new banking partners is proving difficult.\xa0,"Source: CryptoPotato Title: Banking Sector Wary of Crypto After Silvergate, Signature Closures Description: A wave of crypto firms are searching for a home after major US banking partners fell apart this month – but finding new banking partners is proving difficult.\xa0",0
CoinTelegraph,Analysts debate the ETH price outcomes of Ethereum’s upcoming Shapella upgrade,The first three to five weeks after Ethereum’s upcoming Shapella upgrade will likely see an uptick in selling from unstaked deposits.,Source: CoinTelegraph Title: Analysts debate the ETH price outcomes of Ethereum’s upcoming Shapella upgrade Description: The first three to five weeks after Ethereum’s upcoming Shapella upgrade will likely see an uptick in selling from unstaked deposits.,1
CoinTelegraph,Bitcoin touches $29K! Why BTC is unaffected by regulatory pressure,"Join us as we discuss the significance of Bitcoin reaching $29,000 and why it seems to be unaffected by all the regulatory pressure and collapsing banks.","Source: CoinTelegraph Title: Bitcoin touches $29K! Why BTC is unaffected by regulatory pressure Description: Join us as we discuss the significance of Bitcoin reaching $29,000 and why it seems to be unaffected by all the regulatory pressure and collapsing banks.",1
CoinTelegraph,Japan plans to form expert panel to explore digital yen: Report,The ministry’s panel will reportedly focus on developing a framework for a central bank digital currency based on a technical study carried out by the Bank of Japan over the past two years.,Source: CoinTelegraph Title: Japan plans to form expert panel to explore digital yen: Report Description: The ministry’s panel will reportedly focus on developing a framework for a central bank digital currency based on a technical study carried out by the Bank of Japan over the past two years.,0
CoinTelegraph,3 reasons why Bitcoin bulls are well positioned to profit from this week’s $4.2B options expiry,"$4.2 billion in BTC options expire on March 31, and despite weeks of harsh regulatory action against the crypto sector, bulls are well positioned to profit.","Source: CoinTelegraph Title: 3 reasons why Bitcoin bulls are well positioned to profit from this week’s $4.2B options expiry Description: $4.2 billion in BTC options expire on March 31, and despite weeks of harsh regulatory action against the crypto sector, bulls are well positioned to profit.",1
CryptoPotato,Big Short’s Michael Burry Says He “Was Wrong to Say Sell”,The man who predicted the 2008 financial crisis is no longer bearish on the broader market.\xa0,Source: CryptoPotato Title: Big Short’s Michael Burry Says He “Was Wrong to Say Sell” Description: The man who predicted the 2008 financial crisis is no longer bearish on the broader market.\xa0,0
CoinTelegraph,Gnosis launches Hashi bridge aggregator to help prevent hacks,"Bridge protocols LayerZero, Celer, Wormhole, LiFi, and others have already committed to implementing the new protocol.","Source: CoinTelegraph Title: Gnosis launches Hashi bridge aggregator to help prevent hacks Description: Bridge protocols LayerZero, Celer, Wormhole, LiFi, and others have already committed to implementing the new protocol.",0
CryptoPotato,SBF to Enter Not Guilty Plea to Campaign Financing and China Bribery Charges: Report,Sam Bankman-Fried is reportedly planning to plead not guilty to a new 13-count indictment leveled against him by US prosecutors. ,Source: CryptoPotato Title: SBF to Enter Not Guilty Plea to Campaign Financing and China Bribery Charges: Report Description: Sam Bankman-Fried is reportedly planning to plead not guilty to a new 13-count indictment leveled against him by US prosecutors. ,0
CryptoNews,Dogecoin Price Prediction as Burger King Say They 'Need Doge' on Twitter \x93 What's Going On?,"The largest meme coin DOGE is remarkably stable on Thursday after a failed attempt on Wednesday to flip resistance at $0.0771. Dogecoin price is trading 1.3% lower on the day, with $371 million in trading...","Source: CryptoNews Title: Dogecoin Price Prediction as Burger King Say They 'Need Doge' on Twitter \x93 What's Going On? Description: The largest meme coin DOGE is remarkably stable on Thursday after a failed attempt on Wednesday to flip resistance at $0.0771. Dogecoin price is trading 1.3% lower on the day, with $371 million in trading...",0
CoinTelegraph,"Bitcoin profits are taxable in certain cases, says Denmark's supreme court",The country's supreme court released two decisions for cases in which different crypto users gained profits from sales of BTC “made for the purpose of speculation” and mining.,"Source: CoinTelegraph Title: Bitcoin profits are taxable in certain cases, says Denmark's supreme court Description: The country's supreme court released two decisions for cases in which different crypto users gained profits from sales of BTC “made for the purpose of speculation” and mining.",0
CryptoNews,Binance Sees $2.2 Billion Outflows Following CFTC Lawsuit \x93 Should the Crypto Industry be Worried?,Binance has seen a whopping $2.2 billion in outflows after news broke that it has been sued in the US by the CFTC.,Source: CryptoNews Title: Binance Sees $2.2 Billion Outflows Following CFTC Lawsuit \x93 Should the Crypto Industry be Worried? Description: Binance has seen a whopping $2.2 billion in outflows after news broke that it has been sued in the US by the CFTC.,1
CoinTelegraph,Challenger banks vs. crypto institutions: The battle for the future of finance,"Will DeFi and crypto overthrow traditional banks, or is there a middle ground?","Source: CoinTelegraph Title: Challenger banks vs. crypto institutions: The battle for the future of finance Description: Will DeFi and crypto overthrow traditional banks, or is there a middle ground?",0
CryptoNews,"Today in Crypto: Malware Disguised as Tor Used to Steal $400,000 in Crypto in 2023, Telegram Premium Can be Purchased with TON, Boerse Stuttgart Digital Licensed by BaFin for Crypto Custody Business","Get your daily, bite-sized digest of cryptoasset and blockchain-related news.","Source: CryptoNews Title: Today in Crypto: Malware Disguised as Tor Used to Steal $400,000 in Crypto in 2023, Telegram Premium Can be Purchased with TON, Boerse Stuttgart Digital Licensed by BaFin for Crypto Custody Business Description: Get your daily, bite-sized digest of cryptoasset and blockchain-related news.",0
CryptoNews,US or South Korea: Terraform Labs Co-Founder Do Kwon Extradition Fate to Be Decided by Judge,"A judge will decide whether Do Kwon will be extradited to the United States or South Korea, Montenegro's justice minister, Marko Kovac, said.","Source: CryptoNews Title: US or South Korea: Terraform Labs Co-Founder Do Kwon Extradition Fate to Be Decided by Judge Description: A judge will decide whether Do Kwon will be extradited to the United States or South Korea, Montenegro's justice minister, Marko Kovac, said.",1
CoinTelegraph,Cointelegraph Markets Pro’s 390% gain dwarves Bitcoin’s 33% rise,"Cointelegraph Markets Pro alerts beat the market once again, providing seven trading opportunities based on four different asset indicators.","Source: CoinTelegraph Title: Cointelegraph Markets Pro’s 390% gain dwarves Bitcoin’s 33% rise Description: Cointelegraph Markets Pro alerts beat the market once again, providing seven trading opportunities based on four different asset indicators.",1
CoinTelegraph,Indonesian government looks to NFTs to preserve cultural heritage,The Deputy of Indonesia’s Ministry of Tourism and Creative Economy explains how NFTs and cryptocurrency can help solve social and economic challenges within Indonesia.,Source: CoinTelegraph Title: Indonesian government looks to NFTs to preserve cultural heritage Description: The Deputy of Indonesia’s Ministry of Tourism and Creative Economy explains how NFTs and cryptocurrency can help solve social and economic challenges within Indonesia.,1
CoinTelegraph,AI makes the Metaverse safer and more inclusive: Sandbox co-founder,Artificial intelligence continues to be more pervasive in emerging technologies and according to the Sandbox co-founder will make digital spaces more inclusive places.,Source: CoinTelegraph Title: AI makes the Metaverse safer and more inclusive: Sandbox co-founder Description: Artificial intelligence continues to be more pervasive in emerging technologies and according to the Sandbox co-founder will make digital spaces more inclusive places.,1
CryptoPotato,Injective Unveils First-Ever Solana Rollup for Cosmos,Injective had recently integrated with Wormhole which made it the first chain in the Cosmos ecosystem to support Solana assets.,Source: CryptoPotato Title: Injective Unveils First-Ever Solana Rollup for Cosmos Description: Injective had recently integrated with Wormhole which made it the first chain in the Cosmos ecosystem to support Solana assets.,1
CoinTelegraph,Injective launches layer-2 testnet for Solana-based apps in Cosmos,The new testnet is one of the few networks that uses Solana’s Sea Level Virtual Machine (SVM).,Source: CoinTelegraph Title: Injective launches layer-2 testnet for Solana-based apps in Cosmos Description: The new testnet is one of the few networks that uses Solana’s Sea Level Virtual Machine (SVM).,1
CryptoNews,Mask Network Price Prediction as MASK Blasts Up 30% in 7 Days \x93 Next Big Crypto to Explode?,"The price of Mask Network (MASK) has dropped by 6% in the past 24 hours, although at $6.42 it remains up by nearly 30% in the last seven days.","Source: CryptoNews Title: Mask Network Price Prediction as MASK Blasts Up 30% in 7 Days \x93 Next Big Crypto to Explode? Description: The price of Mask Network (MASK) has dropped by 6% in the past 24 hours, although at $6.42 it remains up by nearly 30% in the last seven days.",0
CoinTelegraph,Layer-2 project exec zooms in on the capabilities of Ethereum scaling solutions,"Metis co-founder Elena Sinelnikova delves into the world of layer-2 blockchain technology, and its potential to transform how we interact, collaborate and build the decentralized economy of the future.","Source: CoinTelegraph Title: Layer-2 project exec zooms in on the capabilities of Ethereum scaling solutions Description: Metis co-founder Elena Sinelnikova delves into the world of layer-2 blockchain technology, and its potential to transform how we interact, collaborate and build the decentralized economy of the future.",1
CoinTelegraph,Bitcoin spikes above $29K as 'fakeout' fuels BTC price strength doubts,"BTC price action snatches at $30,000, but Bitcoin market participants dismiss it as a 'deviation' at range highs.","Source: CoinTelegraph Title: Bitcoin spikes above $29K as 'fakeout' fuels BTC price strength doubts Description: BTC price action snatches at $30,000, but Bitcoin market participants dismiss it as a 'deviation' at range highs.",1
CryptoPotato,OKX to Return $157M of Frozen Assets Linked to FTX and Alameda,OKX investigation discovered accounts holding $157 million in virtual assets owned by FTX and Alameda.\xa0,Source: CryptoPotato Title: OKX to Return $157M of Frozen Assets Linked to FTX and Alameda Description: OKX investigation discovered accounts holding $157 million in virtual assets owned by FTX and Alameda.\xa0,0
CoinTelegraph,Crypto donations to surpass $10B in a decade: The Giving Block,"The Giving Block reported that in the last year, USDC took 44% of the crypto donation volume, ETH took 24%, and BTC got 17% within its charity platform.","Source: CoinTelegraph Title: Crypto donations to surpass $10B in a decade: The Giving Block Description: The Giving Block reported that in the last year, USDC took 44% of the crypto donation volume, ETH took 24%, and BTC got 17% within its charity platform.",0
CoinTelegraph,From Bat-Signal to Bitcoin: Projecting 'Orange Pill' on banks as EU drives crypto regulation,The Bitcoin logo lights up on the European Central Bank building in Frankfurt as Bitcoiners urge bankers to ‘study Bitcoin.’,Source: CoinTelegraph Title: From Bat-Signal to Bitcoin: Projecting 'Orange Pill' on banks as EU drives crypto regulation Description: The Bitcoin logo lights up on the European Central Bank building in Frankfurt as Bitcoiners urge bankers to ‘study Bitcoin.’,0
CryptoPotato,Why the Mass Adoption Trifecta is Essential for Blockchain Ecosystems,"Cryptocurrency adoption has undoubtedly been on the rise throughout the past couple of years in terms of both retail and institutional usage. However, now, following a year during which the","Source: CryptoPotato Title: Why the Mass Adoption Trifecta is Essential for Blockchain Ecosystems Description: Cryptocurrency adoption has undoubtedly been on the rise throughout the past couple of years in terms of both retail and institutional usage. However, now, following a year during which the",1
CryptoPotato,Terra’s Daniel Shin Interrogated in Court About the LUNA/UST Crash (Report),Do Kwon's associate- Daniel Shin - reportedly visited a South Korean court to answer key questions related to the Terra failure.,Source: CryptoPotato Title: Terra’s Daniel Shin Interrogated in Court About the LUNA/UST Crash (Report) Description: Do Kwon's associate- Daniel Shin - reportedly visited a South Korean court to answer key questions related to the Terra failure.,0
CoinTelegraph,Revolut not happy with how fintech deals with audit red flags: Report,Revolut reportedly issued a public statement and hired lawyers in March in order to prove “misreporting” of the audit opinion by BDO.,Source: CoinTelegraph Title: Revolut not happy with how fintech deals with audit red flags: Report Description: Revolut reportedly issued a public statement and hired lawyers in March in order to prove “misreporting” of the audit opinion by BDO.,0
CoinTelegraph,From Twitter to the blockchain: The evolution of social media profiles,An in-depth look at tokenizing social media profiles and creating a more transparent ecosystem for social media users.,Source: CoinTelegraph Title: From Twitter to the blockchain: The evolution of social media profiles Description: An in-depth look at tokenizing social media profiles and creating a more transparent ecosystem for social media users.,0
CoinTelegraph,Axie Infinity creator works with studios to push Web3 adoption through new games,Sky Mavis head of business development Kathleen Osgood told Cointelegraph that their goal is to onboard as many people into the ecosystem as possible.,Source: CoinTelegraph Title: Axie Infinity creator works with studios to push Web3 adoption through new games Description: Sky Mavis head of business development Kathleen Osgood told Cointelegraph that their goal is to onboard as many people into the ecosystem as possible.,0
CryptoNews,Sam Bankman-Fried's Legal Expenses Paid by Alameda Money He Granted to His Father \x93Â\xa0What's Going On?,"The founder of the now infamous FTX exchange, Sam Bankman-Fried, has allegedly used the $10 million he had sent to his father while still the CEO of the fallen exchange for his legal fees.","Source: CryptoNews Title: Sam Bankman-Fried's Legal Expenses Paid by Alameda Money He Granted to His Father \x93Â\xa0What's Going On? Description: The founder of the now infamous FTX exchange, Sam Bankman-Fried, has allegedly used the $10 million he had sent to his father while still the CEO of the fallen exchange for his legal fees.",0
CryptoNews,Hong Kong-Based Fund Set to Raise $100 Million for Web3 Startups Amid City's Crypto Revamp,A new Hong Kong-based fund is set to raise $100 million to invest in crypto companies as the city is accelerating toward its goal of becoming a global crypto hub with a more friendly regulatory stance.,Source: CryptoNews Title: Hong Kong-Based Fund Set to Raise $100 Million for Web3 Startups Amid City's Crypto Revamp Description: A new Hong Kong-based fund is set to raise $100 million to invest in crypto companies as the city is accelerating toward its goal of becoming a global crypto hub with a more friendly regulatory stance.,0
CoinTelegraph,"DeFi KYC: Not an issue as ‘99% have nothing to hide,’ industry execs say","Traditional finance observes “money laundering happening every day” despite rigorous KYC measures, according to DeFi industry execs.","Source: CoinTelegraph Title: DeFi KYC: Not an issue as ‘99% have nothing to hide,’ industry execs say Description: Traditional finance observes “money laundering happening every day” despite rigorous KYC measures, according to DeFi industry execs.",0
CryptoNews,Bitcoin Price and Ethereum Prediction: Will US Final GDP Data Impact BTC and ETH Price Movements?,"Bitcoin, the world's leading cryptocurrency, has recently experienced strong performance, surging over 4% in just a few hours. Moreover, the performance of other digital currencies, like Ethereum, has also gained momentum. This indicates that the cryptocurrency market is growing in popularity and could continue to appreciate in value.","Source: CryptoNews Title: Bitcoin Price and Ethereum Prediction: Will US Final GDP Data Impact BTC and ETH Price Movements? Description: Bitcoin, the world's leading cryptocurrency, has recently experienced strong performance, surging over 4% in just a few hours. Moreover, the performance of other digital currencies, like Ethereum, has also gained momentum. This indicates that the cryptocurrency market is growing in popularity and could continue to appreciate in value.",1
CryptoPotato,SEC Sues Beaxy for Operating an Unregistered Securities Platform,Beaxy has become the latest crypto platform to be charged with running an unregistered securities exchange by the SEC.,Source: CryptoPotato Title: SEC Sues Beaxy for Operating an Unregistered Securities Platform Description: Beaxy has become the latest crypto platform to be charged with running an unregistered securities exchange by the SEC.,0
CoinTelegraph,OKX seeks Australian expansion citing 'huge appetite' for crypto,The exchange's chief marketing officer believes Australians are above-the-curve when it comes to crypto education and interest.,Source: CoinTelegraph Title: OKX seeks Australian expansion citing 'huge appetite' for crypto Description: The exchange's chief marketing officer believes Australians are above-the-curve when it comes to crypto education and interest.,0
CryptoPotato,Gary Gensler Wants More SEC Funding to Crack Down on ‘Wild West’ Crypto,"Gensler made another sweeping attack on the crypto industry, requesting a bigger budget for his agency to tackle crypto ‘misconduct.’","Source: CryptoPotato Title: Gary Gensler Wants More SEC Funding to Crack Down on ‘Wild West’ Crypto Description: Gensler made another sweeping attack on the crypto industry, requesting a bigger budget for his agency to tackle crypto ‘misconduct.’",0
CoinTelegraph,Bitcoin price briefly hits $29K despite regulatory crackdowns,"Despite ongoing crypto crackdowns, the price of BTC briefly tipped over $29,132.82 on March 30, clocking a new high for 2023.","Source: CoinTelegraph Title: Bitcoin price briefly hits $29K despite regulatory crackdowns Description: Despite ongoing crypto crackdowns, the price of BTC briefly tipped over $29,132.82 on March 30, clocking a new high for 2023.",1
CryptoPotato,SBF is Paying His Legal Fees Using Alameda’s Money: Report,"Buried in a mountain of charges from the Justice Department, Former FTX CEO Sam Bankman-Fried (SBF) is reportedly paying his legal fees with money gifted to his father that was","Source: CryptoPotato Title: SBF is Paying His Legal Fees Using Alameda’s Money: Report Description: Buried in a mountain of charges from the Justice Department, Former FTX CEO Sam Bankman-Fried (SBF) is reportedly paying his legal fees with money gifted to his father that was",0
CryptoPotato,Hollywood Actor Matt Damon Explains Why he Appeared on Crypto.com Ad,Damon disclosed that Crypto.com's $1 million financing to his charity foundation had been the main reason for his involvement in the commercial.,Source: CryptoPotato Title: Hollywood Actor Matt Damon Explains Why he Appeared on Crypto.com Ad Description: Damon disclosed that Crypto.com's $1 million financing to his charity foundation had been the main reason for his involvement in the commercial.,0
CoinTelegraph,Optimism reigned at Paris Blockchain Week,Careful optimism was the theme at this year's Paris Blockchain Week. Builders will build and the crypto community will keep going.,Source: CoinTelegraph Title: Optimism reigned at Paris Blockchain Week Description: Careful optimism was the theme at this year's Paris Blockchain Week. Builders will build and the crypto community will keep going.,0
