source,title,description,text,label
CryptoPotato,Gucci Forges Multi-Year Partnership With BAYC Creator YUGA Labs,"Gucci plans on capitalizing on the expertise of creatives through strategic partnerships, according to a statement.","Source: CryptoPotato Title: Gucci Forges Multi-Year Partnership With BAYC Creator YUGA Labs Description: Gucci plans on capitalizing on the expertise of creatives through strategic partnerships, according to a statement.",0
CoinTelegraph,MakerDAO passes new 'constitution' to formalize governance process,"The document creates multiple offices tasked with fulfilling various jobs for the protocol, each with their own powers and responsibilities.","Source: CoinTelegraph Title: MakerDAO passes new 'constitution' to formalize governance process Description: The document creates multiple offices tasked with fulfilling various jobs for the protocol, each with their own powers and responsibilities.",0
CryptoNews,Bitcoin is Set to Disrupt Africa's $85 Billion Financial System \x93 Here's What You Need to Know,"Bitcoin is on its way to become the currency of choice for moving money between African countries, a new CNBC report has revealed.","Source: CryptoNews Title: Bitcoin is Set to Disrupt Africa's $85 Billion Financial System \x93 Here's What You Need to Know Description: Bitcoin is on its way to become the currency of choice for moving money between African countries, a new CNBC report has revealed.",0
CoinTelegraph,Euler Finance exploiter returns another $37.1M worth of ETH and DAI,The exploiter originally drained $195 million worth of ETH and tokens from the protocol but has now returned around $138 million.,Source: CoinTelegraph Title: Euler Finance exploiter returns another $37.1M worth of ETH and DAI Description: The exploiter originally drained $195 million worth of ETH and tokens from the protocol but has now returned around $138 million.,1
CoinTelegraph,"Price analysis 3/27: SPX, DXY, BTC, ETH, BNB, XRP, ADA, MATIC, DOGE, SOL","The crypto market corrected on news of the CFTC suing Binance and its CEO Changpeng Zhao, but technical charts reveal a silver lining.","Source: CoinTelegraph Title: Price analysis 3/27: SPX, DXY, BTC, ETH, BNB, XRP, ADA, MATIC, DOGE, SOL Description: The crypto market corrected on news of the CFTC suing Binance and its CEO Changpeng Zhao, but technical charts reveal a silver lining.",1
CryptoPotato,Chinese Crypto Exec Quits Firm Amidst Sexual Harrasment Probe,The company had recently\xa0initiated an investigation into his behavior in the workplace.,Source: CryptoPotato Title: Chinese Crypto Exec Quits Firm Amidst Sexual Harrasment Probe Description: The company had recently\xa0initiated an investigation into his behavior in the workplace.,0
CryptoNews,"Best Crypto to Buy Now 27 March \x93 LTC, CFX, MASK",The cryptocurrency market was caught off guard today as news broke of a CFTC lawsuit targeting leading crypto exchange Binance. How might the recent developments affect the selection of the best cryptos to buy now?,"Source: CryptoNews Title: Best Crypto to Buy Now 27 March \x93 LTC, CFX, MASK Description: The cryptocurrency market was caught off guard today as news broke of a CFTC lawsuit targeting leading crypto exchange Binance. How might the recent developments affect the selection of the best cryptos to buy now?",1
CryptoNews,Crypto Listing and Delisting Announcements: Week 13,"Here is our weekly collection of digital asset listing and delisting, trading pair-related announcements by crypto exchanges that we found last week and today.Have we missed something? Do you have information about new listings and/or...","Source: CryptoNews Title: Crypto Listing and Delisting Announcements: Week 13 Description: Here is our weekly collection of digital asset listing and delisting, trading pair-related announcements by crypto exchanges that we found last week and today.Have we missed something? Do you have information about new listings and/or...",1
CoinTelegraph,"Ted Cruz and Ron DeSantis take on the ‘digital dollar’: Law Decoded, March 20–27",Two lawmakers in one week weighed in against the possibility of a United States central bank digital currency.,"Source: CoinTelegraph Title: Ted Cruz and Ron DeSantis take on the ‘digital dollar’: Law Decoded, March 20–27 Description: Two lawmakers in one week weighed in against the possibility of a United States central bank digital currency.",0
CryptoPotato,What are Binance and CZ Being Accused Of? A Closer Look at the CFTC Filing,Here are the CFTC’s accusations against Binance that CZ is choosing to ignore.\xa0,Source: CryptoPotato Title: What are Binance and CZ Being Accused Of? A Closer Look at the CFTC Filing Description: Here are the CFTC’s accusations against Binance that CZ is choosing to ignore.\xa0,1
CoinTelegraph,An overview of fake product detection using blockchain technology,"Blockchain technology can be used for fake product detection, providing secure and transparent records of transactions to prevent fraud and counterfeiting.","Source: CoinTelegraph Title: An overview of fake product detection using blockchain technology Description: Blockchain technology can be used for fake product detection, providing secure and transparent records of transactions to prevent fraud and counterfeiting.",0
CryptoNews,Litecoin Price Prediction as Bullish Price Action Catches Attention of Crypto Twitter \x93 Can LTC Hit $100?,"Litecoin's near-term price outlook isn't great as it dips back below its 50DMA, but the longer-term outlook remains robust according to these analysts.","Source: CryptoNews Title: Litecoin Price Prediction as Bullish Price Action Catches Attention of Crypto Twitter \x93 Can LTC Hit $100? Description: Litecoin's near-term price outlook isn't great as it dips back below its 50DMA, but the longer-term outlook remains robust according to these analysts.",0
CoinTelegraph,Traditional finance fears drive digital asset investment inflows to $160M,"According to CoinShares, crypto investment products experienced weekly inflows of $160 million, the largest since July 2022.","Source: CoinTelegraph Title: Traditional finance fears drive digital asset investment inflows to $160M Description: According to CoinShares, crypto investment products experienced weekly inflows of $160 million, the largest since July 2022.",1
CryptoNews,Breaking: Binance Sued By CFTC Over Offering Unregistered Crypto Derivate Trading Products in US,"In its latest lawsuit, the CFTC claims that Bitcoin, Ether, Litecoin, Tether and Binance USD are all commodities.","Source: CryptoNews Title: Breaking: Binance Sued By CFTC Over Offering Unregistered Crypto Derivate Trading Products in US Description: In its latest lawsuit, the CFTC claims that Bitcoin, Ether, Litecoin, Tether and Binance USD are all commodities.",1
CoinTelegraph,XRP price: 'sell the news' moment nears after crypto-leading 20% weekly gain,XRP whales have been accumulating since February with only days remaining until the SEC vs. Ripple lawsuit could reach its potential conclusion.,Source: CoinTelegraph Title: XRP price: 'sell the news' moment nears after crypto-leading 20% weekly gain Description: XRP whales have been accumulating since February with only days remaining until the SEC vs. Ripple lawsuit could reach its potential conclusion.,1
CryptoPotato,"Is Gold Still a “Boomer Rock” Next to Bitcoin? Not This Year, Says Bloomberg Analyst",The banking crisis may finally spur gold to break past its longtime $2000/oz barrier.\xa0,"Source: CryptoPotato Title: Is Gold Still a “Boomer Rock” Next to Bitcoin? Not This Year, Says Bloomberg Analyst Description: The banking crisis may finally spur gold to break past its longtime $2000/oz barrier.\xa0",1
CryptoNews,Amazon Drops NFT Bombshell: Official Email Teases Digital Tokens and Platform Gallery,"The e-commerce giant Amazon has officially jumped on the NFT bandwagon, an email sent out to at least one customer suggests.","Source: CryptoNews Title: Amazon Drops NFT Bombshell: Official Email Teases Digital Tokens and Platform Gallery Description: The e-commerce giant Amazon has officially jumped on the NFT bandwagon, an email sent out to at least one customer suggests.",1
CryptoNews,Super Rich Crypto Investor Allegedly Abducted and Held for Ransom \x93Â\xa0Here's What Happened,"A Canadian self-proclaimed \x9ccrypto king,\x9d who allegedly defrauded investors out of millions, was kidnapped, tortured, and held for a multi-million-dollar ransom.","Source: CryptoNews Title: Super Rich Crypto Investor Allegedly Abducted and Held for Ransom \x93Â\xa0Here's What Happened Description: A Canadian self-proclaimed \x9ccrypto king,\x9d who allegedly defrauded investors out of millions, was kidnapped, tortured, and held for a multi-million-dollar ransom.",0
CoinTelegraph,From PayPal to Web3: Digital identity could play key role in unlocking mainstream adoption,"The financial payments industry has seen its fair share of evolution, and is currently at an inflection point with Web3.","Source: CoinTelegraph Title: From PayPal to Web3: Digital identity could play key role in unlocking mainstream adoption Description: The financial payments industry has seen its fair share of evolution, and is currently at an inflection point with Web3.",1
CoinTelegraph,"Gaming and Web3 outlook, what’s available on the market? Report","Blockchain gaming is moving fast, are you up-to-speed? Cointelegraph Research’s latest report reviews 20 games of today, and a few to be looking out for tomorrow.","Source: CoinTelegraph Title: Gaming and Web3 outlook, what’s available on the market? Report Description: Blockchain gaming is moving fast, are you up-to-speed? Cointelegraph Research’s latest report reviews 20 games of today, and a few to be looking out for tomorrow.",0
CryptoPotato,Binance Continues Global Expansion With New ‘Web3 Outpost’ in Georgia,Binance had previously signed MoU as well as MoC with Georgian institutions earlier this year.,Source: CryptoPotato Title: Binance Continues Global Expansion With New ‘Web3 Outpost’ in Georgia Description: Binance had previously signed MoU as well as MoC with Georgian institutions earlier this year.,0
CoinTelegraph,Polygon's ‘holy grail’ Ethereum scaling zkEVM beta hits mainnet,"Ethereum layer 2 scaling platform Polygon has released its zkEVM to mainnet beta, allowing developers to deploy smart contracts with increased finality and lower costs.","Source: CoinTelegraph Title: Polygon's ‘holy grail’ Ethereum scaling zkEVM beta hits mainnet Description: Ethereum layer 2 scaling platform Polygon has released its zkEVM to mainnet beta, allowing developers to deploy smart contracts with increased finality and lower costs.",1
CryptoNews,Japan Set to Ask G7 & G20 to Bolster Crypto Regulation \x93 And Not For the First Time,Japan is set to make another attempt to convince G7 and G20 leaders to adopt streamlined crypto regulations.,Source: CryptoNews Title: Japan Set to Ask G7 & G20 to Bolster Crypto Regulation \x93 And Not For the First Time Description: Japan is set to make another attempt to convince G7 and G20 leaders to adopt streamlined crypto regulations.,0
CoinTelegraph,Top 7 legal and compliance jobs in the crypto market,Explore essential skills for top legal and compliance jobs in the crypto market.,Source: CoinTelegraph Title: Top 7 legal and compliance jobs in the crypto market Description: Explore essential skills for top legal and compliance jobs in the crypto market.,0
CoinTelegraph,Michael Saylor’s MicroStrategy repays Silvergate loan and buys 6.5K BTC,"MicroStrategy has increased its total Bitcoins holdings to 138,955 BTC, purchased for $4.1 billion at an average of $29,817 per coin.","Source: CoinTelegraph Title: Michael Saylor’s MicroStrategy repays Silvergate loan and buys 6.5K BTC Description: MicroStrategy has increased its total Bitcoins holdings to 138,955 BTC, purchased for $4.1 billion at an average of $29,817 per coin.",1
CoinTelegraph,Paris Blockchain Week 2023: A net positive for the entire crypto industry,"The theme of PBW revolved around the evolution of Web3 in the mainstream, the past, present and future of the crypto industry.","Source: CoinTelegraph Title: Paris Blockchain Week 2023: A net positive for the entire crypto industry Description: The theme of PBW revolved around the evolution of Web3 in the mainstream, the past, present and future of the crypto industry.",0
CryptoNews,XRP Price Prediction as XRP Becomes Best Performing Crypto Over the Last 7 Days \x93 Is a New Bull Market Starting?,"The XRP price has gained by 1% in the past 24 hours, with its move to $0.468157 making it the best-performing top-100 cryptocurrency within the past week.","Source: CryptoNews Title: XRP Price Prediction as XRP Becomes Best Performing Crypto Over the Last 7 Days \x93 Is a New Bull Market Starting? Description: The XRP price has gained by 1% in the past 24 hours, with its move to $0.468157 making it the best-performing top-100 cryptocurrency within the past week.",0
CryptoNews,Venezuela's Anti-Corruption Investigation Rocks Cryptocurrency Industry: Exchanges and Mining Farms Shut Down,"Venezuelan mining farms and exchanges have reportedly been ordered to shut down over the past few days, following the President's order to restructure the country's crypto regulatory agency. They seem to have been a casualty of an investigation that resulted in the arrest of 21 individuals.","Source: CryptoNews Title: Venezuela's Anti-Corruption Investigation Rocks Cryptocurrency Industry: Exchanges and Mining Farms Shut Down Description: Venezuelan mining farms and exchanges have reportedly been ordered to shut down over the past few days, following the President's order to restructure the country's crypto regulatory agency. They seem to have been a casualty of an investigation that resulted in the arrest of 21 individuals.",0
CryptoNews,Do Kwon Says His 'Rights Are Being Violated' \x93 But He Could Be Saved by a Legal Twist,The Terraform Labs CEO Do Kwon has complained that his \x9crights\x9d are being \x9cviolated.\x9d And legal experts warn that it could be \x9cyears\x9d before his case is heard if he is extradited to face charges in his native South Korea.,Source: CryptoNews Title: Do Kwon Says His 'Rights Are Being Violated' \x93 But He Could Be Saved by a Legal Twist Description: The Terraform Labs CEO Do Kwon has complained that his \x9crights\x9d are being \x9cviolated.\x9d And legal experts warn that it could be \x9cyears\x9d before his case is heard if he is extradited to face charges in his native South Korea.,0
CryptoNews,Shiba Inu Price Prediction as SHIB Jumps 8% from Recent Bottom \x93 Where is the Next SHIB Target?,"The Shiba Inu price has dropped by 0.5% in the past 24 hours, yet its indicators suggest a recovery isn't far away.","Source: CryptoNews Title: Shiba Inu Price Prediction as SHIB Jumps 8% from Recent Bottom \x93 Where is the Next SHIB Target? Description: The Shiba Inu price has dropped by 0.5% in the past 24 hours, yet its indicators suggest a recovery isn't far away.",0
CryptoNews,Nvidia CTO Claims Cryptocurrencies are Useless: AI Chatbots a Better Use of Processing Power,"Nvidia News: Anti-Crypto Nvidia CTO Michael Kagan Dismissed Cryptocurrencies In A Recent Interview With The Guardian, But Is Kagan Right To Adopt This Luddite Stance? Find Out Here!","Source: CryptoNews Title: Nvidia CTO Claims Cryptocurrencies are Useless: AI Chatbots a Better Use of Processing Power Description: Nvidia News: Anti-Crypto Nvidia CTO Michael Kagan Dismissed Cryptocurrencies In A Recent Interview With The Guardian, But Is Kagan Right To Adopt This Luddite Stance? Find Out Here!",0
CoinTelegraph,Crypto exchange Binance launches new regional hub in Georgia,"Currently employing 25 people in Georgia, Binance aims to create “dozens more jobs” with the launch of its regional hub by the end of 2023.","Source: CoinTelegraph Title: Crypto exchange Binance launches new regional hub in Georgia Description: Currently employing 25 people in Georgia, Binance aims to create “dozens more jobs” with the launch of its regional hub by the end of 2023.",0
CryptoNews,Chinese State-Owned Banks Extend Crypto-Friendly Hand to Hong Kong Firms,China's state-owned banks are offering services to local cryptocurrency companies in Hong Kong as the city embraces a more friendly regulatory stance.,Source: CryptoNews Title: Chinese State-Owned Banks Extend Crypto-Friendly Hand to Hong Kong Firms Description: China's state-owned banks are offering services to local cryptocurrency companies in Hong Kong as the city embraces a more friendly regulatory stance.,0
CoinTelegraph,The benefits of trading Forex pairs in decentralized finance,Crypto holders can get synthetic exposure to Forex pairs directly on-chain thanks to decentralized leveraged trading platforms.,Source: CoinTelegraph Title: The benefits of trading Forex pairs in decentralized finance Description: Crypto holders can get synthetic exposure to Forex pairs directly on-chain thanks to decentralized leveraged trading platforms.,0
CoinTelegraph,Will BTC ditch the bear market? 5 things to know in Bitcoin this week,Bitcoin price is gearing up for a key monthly close that could see it dump its 2022 bear market for good.,Source: CoinTelegraph Title: Will BTC ditch the bear market? 5 things to know in Bitcoin this week Description: Bitcoin price is gearing up for a key monthly close that could see it dump its 2022 bear market for good.,0
CoinTelegraph,How to buy NFTs without owning crypto,Buying NFTs without crypto can be challenging. Explore payment options offered by marketplaces or use third-party services.,Source: CoinTelegraph Title: How to buy NFTs without owning crypto Description: Buying NFTs without crypto can be challenging. Explore payment options offered by marketplaces or use third-party services.,0
CryptoPotato,Terra’s Do Kwon to Appeal His Arrest Extension (Report),Kwon's attorneys will seek to reduce the 30-day detention extention period ruled by the Montenegrin authorities.,Source: CryptoPotato Title: Terra’s Do Kwon to Appeal His Arrest Extension (Report) Description: Kwon's attorneys will seek to reduce the 30-day detention extention period ruled by the Montenegrin authorities.,0
CryptoNews,Bitcoin Price and Ethereum Prediction: A Packed Week Ahead - Potential Breakout Catalysts for BTC and ETH,"Bitcoin (BTC), the world's largest cryptocurrency, has gained popularity and experienced a spike in recent days, hitting over $28,000, a 22 percent increase this month and a 65 percent increase since the beginning of the year. Meanwhile, Ethereum (ETH), the second largest cryptocurrency, has been strongly bid around the $1,750 mark.","Source: CryptoNews Title: Bitcoin Price and Ethereum Prediction: A Packed Week Ahead - Potential Breakout Catalysts for BTC and ETH Description: Bitcoin (BTC), the world's largest cryptocurrency, has gained popularity and experienced a spike in recent days, hitting over $28,000, a 22 percent increase this month and a 65 percent increase since the beginning of the year. Meanwhile, Ethereum (ETH), the second largest cryptocurrency, has been strongly bid around the $1,750 mark.",1
CryptoPotato,Arbitrum TVL Soars 22% Weekly Following Much Anticipated ARB Airdrop,The total value locked in Arbitrum is soaring following the distribution of its much-anticipated ARB airdrop.,Source: CryptoPotato Title: Arbitrum TVL Soars 22% Weekly Following Much Anticipated ARB Airdrop Description: The total value locked in Arbitrum is soaring following the distribution of its much-anticipated ARB airdrop.,1
CoinTelegraph,"$4M 'exit scam' suspected as Kokomo Finance flies off radar, token plunges","Kokomo Finance's social media presence and websites are offline, while the price of the KOKO token fell more than 95% within a matter of minutes.","Source: CoinTelegraph Title: $4M 'exit scam' suspected as Kokomo Finance flies off radar, token plunges Description: Kokomo Finance's social media presence and websites are offline, while the price of the KOKO token fell more than 95% within a matter of minutes.",1
CoinTelegraph,"Minecraft, GTA may change their tune on blockchain yet: GameFi execs",It could all be sparked with just one Web3 success story.,"Source: CoinTelegraph Title: Minecraft, GTA may change their tune on blockchain yet: GameFi execs Description: It could all be sparked with just one Web3 success story.",0
CoinTelegraph,Coinbase wants devs to build inflation-pegged 'flatcoins' on its new 'Base' network,Coinbase explained that it is now “more important than ever” to build an inflation-tracking stablecoin that negates poor monetary policy decisions of central banks.,Source: CoinTelegraph Title: Coinbase wants devs to build inflation-pegged 'flatcoins' on its new 'Base' network Description: Coinbase explained that it is now “more important than ever” to build an inflation-tracking stablecoin that negates poor monetary policy decisions of central banks.,0
CoinTelegraph,"XRP, LTC, XMR and AVAX show bullish signs as Bitcoin battles to hold $28K","Bitcoin price is making another run at $28,000 and this is luring altcoin traders into XRP, LTC, XMR and AVAX positions.","Source: CoinTelegraph Title: XRP, LTC, XMR and AVAX show bullish signs as Bitcoin battles to hold $28K Description: Bitcoin price is making another run at $28,000 and this is luring altcoin traders into XRP, LTC, XMR and AVAX positions.",1
CryptoPotato,Every Third US Crypto Investor Was a Victim of Theft: Kaspersky Report,"Kaspersky urged people to be more careful when storing their passwords, adding that 14% of investors have not made any efforts to do so.","Source: CryptoPotato Title: Every Third US Crypto Investor Was a Victim of Theft: Kaspersky Report Description: Kaspersky urged people to be more careful when storing their passwords, adding that 14% of investors have not made any efforts to do so.",0
CoinTelegraph,Community-driven crypto projects still thriving despite headwinds,"Community engagement has always been a key aspect of crypto, and it's proving its value during bear markets.","Source: CoinTelegraph Title: Community-driven crypto projects still thriving despite headwinds Description: Community engagement has always been a key aspect of crypto, and it's proving its value during bear markets.",0
CoinTelegraph,Bitcoin is 1 week away from 'confirming' new bull market — analyst,"BTC price action is copying historical patterns to deliver a classic Bitcoin bull market comeback, says Rekt Capital.","Source: CoinTelegraph Title: Bitcoin is 1 week away from 'confirming' new bull market — analyst Description: BTC price action is copying historical patterns to deliver a classic Bitcoin bull market comeback, says Rekt Capital.",0
CryptoPotato,Mumbai Woman Loses $30K in Crypto Scam to Man She Met on Matrimonial Site: Report,The ‘US-based engineer’ and prospective husband stopped communicating when she tried to withdraw her money.,Source: CryptoPotato Title: Mumbai Woman Loses $30K in Crypto Scam to Man She Met on Matrimonial Site: Report Description: The ‘US-based engineer’ and prospective husband stopped communicating when she tried to withdraw her money.,0
CoinTelegraph,How does the economy work?,The economy is a system of producing and exchanging goods and services in a society.,Source: CoinTelegraph Title: How does the economy work? Description: The economy is a system of producing and exchanging goods and services in a society.,0
CryptoPotato,EUL Jumps 35% as Euler Finance Hacker Returns Another $100M Worth of Ethereum,"The hacker made two transactions, and the total value exceeds $100 million worth of ETH. ","Source: CryptoPotato Title: EUL Jumps 35% as Euler Finance Hacker Returns Another $100M Worth of Ethereum Description: The hacker made two transactions, and the total value exceeds $100 million worth of ETH. ",1
CryptoNews,Euler Finance Hacker Returns $100 Million in Surprising Act \x93 Here's What Happened,"In a remarkable development, the Euler Finance exploiter has returned a huge portion of the $200 million stolen funds to the protocol.","Source: CryptoNews Title: Euler Finance Hacker Returns $100 Million in Surprising Act \x93 Here's What Happened Description: In a remarkable development, the Euler Finance exploiter has returned a huge portion of the $200 million stolen funds to the protocol.",1
CoinTelegraph,Tim Draper recommends founders hold 'at least' two payrolls 'worth of cash' in crypto,American venture capital investor Tim Draper warned business founders to prepare for 'more and more' bank failures if the government continues to 'print money and whipsaw interest rates.',Source: CoinTelegraph Title: Tim Draper recommends founders hold 'at least' two payrolls 'worth of cash' in crypto Description: American venture capital investor Tim Draper warned business founders to prepare for 'more and more' bank failures if the government continues to 'print money and whipsaw interest rates.',1
CryptoPotato,Animoca Brands Slashes Target of Metaverse Fund by 20%: Report,This is the second time Animoca Brands cut the target size of its metaverse fund twice.,Source: CryptoPotato Title: Animoca Brands Slashes Target of Metaverse Fund by 20%: Report Description: This is the second time Animoca Brands cut the target size of its metaverse fund twice.,0
CryptoPotato,India to Have Over 150 Million Crypto Users by the End of 2023? (Study),India's crypto adoption rate could surpass that of the US and the UK by the year's end.,Source: CryptoPotato Title: India to Have Over 150 Million Crypto Users by the End of 2023? (Study) Description: India's crypto adoption rate could surpass that of the US and the UK by the year's end.,1
